[
  {
    "book_id": "example-org",
    "committed_at": "2026-09-02T00:05:00Z",
    "epistemic_type": "producer_claim",
    "event_time_claim": "2026-09-02T00:00:00Z",
    "links": [
      {
        "target": "5653a61b4ed088f818552f3e386bfdbc0c4272f99d8fc5084ce38b86e7f4398b",
        "type": "closes"
      }
    ],
    "record_type": "close",
    "seq": 41,
    "statement": {
      "note": "EXAMPLE-ORG own Close record for 2026-09-01, v0 placeholder",
      "period": {
        "end": "2026-09-02T00:00:00Z",
        "start": "2026-09-01T00:00:00Z"
      }
    },
    "subject_ref": "ec:example-org-outcomes-reconcile:2026-09-25@1",
    "v": 1
  }
]
